[
  {
    "observation_id": "USGS-NPL-2015-DEATHS",
    "event_id": "GDA-EQ-2015-NPL",
    "field": "deaths",
    "raw_value": 9000,
    "normalized_value": 9000,
    "unit": "persons",
    "definition": "Approximate fatalities reported by USGS for the 2015 M7.8 Nepal earthquake sequence.",
    "status": "estimated",
    "source": {"source_id": "USGS-NPL-2015", "publisher": "U.S. Geological Survey", "dataset": "M7.8 Nepal Earthquake, 2015", "record_id": null, "url": "https://www.usgs.gov/programs/earthquake-hazards/science/m78-nepal-earthquake-2015-a-small-push-mt-everest", "license_status": "public government source; verify page-specific media terms", "retrieved_at": "2026-08-28T00:00:00Z"},
    "conflict_id": null,
    "resolution_id": null,
    "audit_state": "AUDITED",
    "audit_notes": "USGS describes the value as about 9,000; retained as an estimate rather than a precise count."
  },
  {
    "observation_id": "USGS-NPL-2015-INJURED",
    "event_id": "GDA-EQ-2015-NPL",
    "field": "injured",
    "raw_value": 23000,
    "normalized_value": 23000,
    "unit": "persons",
    "definition": "Injuries reported by USGS for the 2015 M7.8 Nepal earthquake sequence.",
    "status": "estimated",
    "source": {"source_id": "USGS-NPL-2015", "publisher": "U.S. Geological Survey", "dataset": "M7.8 Nepal Earthquake, 2015", "record_id": null, "url": "https://www.usgs.gov/programs/earthquake-hazards/science/m78-nepal-earthquake-2015-a-small-push-mt-everest", "license_status": "public government source; verify page-specific media terms", "retrieved_at": "2026-08-28T00:00:00Z"},
    "conflict_id": null,
    "resolution_id": null,
    "audit_state": "AUDITED",
    "audit_notes": "USGS reports 23,000 injuries; later publications cite over 21,000. The difference is retained as a source-definition/time-state issue, not silently reconciled."
  },
  {
    "observation_id": "USGS-NPL-2015-HOUSES-DESTROYED",
    "event_id": "GDA-EQ-2015-NPL",
    "field": "houses.destroyed",
    "raw_value": 500717,
    "normalized_value": 500717,
    "unit": "houses",
    "definition": "Houses destroyed in Nepal reported in the USGS partial damage/fatality tally.",
    "status": "reported",
    "source": {"source_id": "USGS-NPL-2015", "publisher": "U.S. Geological Survey", "dataset": "M7.8 Nepal Earthquake, 2015", "record_id": null, "url": "https://www.usgs.gov/programs/earthquake-hazards/science/m78-nepal-earthquake-2015-a-small-push-mt-everest", "license_status": "public government source; verify page-specific media terms", "retrieved_at": "2026-08-28T00:00:00Z"},
    "conflict_id": null,
    "resolution_id": null,
    "audit_state": "AUDITED",
    "audit_notes": null
  },
  {
    "observation_id": "USGS-NPL-2015-HOUSES-DAMAGED",
    "event_id": "GDA-EQ-2015-NPL",
    "field": "houses.damaged",
    "raw_value": 269190,
    "normalized_value": 269190,
    "unit": "houses",
    "definition": "Houses damaged in Nepal reported in the USGS partial damage/fatality tally.",
    "status": "reported",
    "source": {"source_id": "USGS-NPL-2015", "publisher": "U.S. Geological Survey", "dataset": "M7.8 Nepal Earthquake, 2015", "record_id": null, "url": "https://www.usgs.gov/programs/earthquake-hazards/science/m78-nepal-earthquake-2015-a-small-push-mt-everest", "license_status": "public government source; verify page-specific media terms", "retrieved_at": "2026-08-28T00:00:00Z"},
    "conflict_id": null,
    "resolution_id": null,
    "audit_state": "AUDITED",
    "audit_notes": null
  },
  {
    "observation_id": "USGS-SULAWESI-2018-DEATHS",
    "event_id": "GDA-EQ-2018-IDN-SULAWESI",
    "field": "deaths",
    "raw_value": 2077,
    "normalized_value": 2077,
    "unit": "persons",
    "definition": "At least 2,077 people killed by combined effects of earthquake, tsunami, liquefaction and landslides in Central Sulawesi.",
    "status": "reported",
    "source": {"source_id": "USGS-IDN-2018-PALU", "publisher": "U.S. Geological Survey", "dataset": "USGS event impact page", "record_id": "us1000h3p4", "url": "https://earthquake.usgs.gov/earthquakes/eventpage/us1000h3p4/impact", "license_status": "public government source", "retrieved_at": "2026-08-28T00:00:00Z"},
    "conflict_id": null,
    "resolution_id": null,
    "audit_state": "AUDITED",
    "audit_notes": "This value is deliberately scoped to the combined disaster sequence, not earthquake shaking alone."
  },
  {
    "observation_id": "USGS-SULAWESI-2018-INJURED",
    "event_id": "GDA-EQ-2018-IDN-SULAWESI",
    "field": "injured",
    "raw_value": 4438,
    "normalized_value": 4438,
    "unit": "persons",
    "definition": "Injured people from the combined earthquake, tsunami, liquefaction and landslide disaster sequence.",
    "status": "reported",
    "source": {"source_id": "USGS-IDN-2018-PALU", "publisher": "U.S. Geological Survey", "dataset": "USGS event impact page", "record_id": "us1000h3p4", "url": "https://earthquake.usgs.gov/earthquakes/eventpage/us1000h3p4/impact", "license_status": "public government source", "retrieved_at": "2026-08-28T00:00:00Z"},
    "conflict_id": null,
    "resolution_id": null,
    "audit_state": "AUDITED",
    "audit_notes": null
  },
  {
    "observation_id": "USGS-SULAWESI-2018-MISSING",
    "event_id": "GDA-EQ-2018-IDN-SULAWESI",
    "field": "missing",
    "raw_value": 1075,
    "normalized_value": 1075,
    "unit": "persons",
    "definition": "Missing people reported in the USGS combined-impact summary.",
    "status": "reported",
    "source": {"source_id": "USGS-IDN-2018-PALU", "publisher": "U.S. Geological Survey", "dataset": "USGS event impact page", "record_id": "us1000h3p4", "url": "https://earthquake.usgs.gov/earthquakes/eventpage/us1000h3p4/impact", "license_status": "public government source", "retrieved_at": "2026-08-28T00:00:00Z"},
    "conflict_id": null,
    "resolution_id": null,
    "audit_state": "AUDITED",
    "audit_notes": null
  },
  {
    "observation_id": "USGS-SULAWESI-2018-DISPLACED",
    "event_id": "GDA-EQ-2018-IDN-SULAWESI",
    "field": "displaced",
    "raw_value": 206524,
    "normalized_value": 206524,
    "unit": "persons",
    "definition": "Displaced people reported in the USGS combined-impact summary.",
    "status": "reported",
    "source": {"source_id": "USGS-IDN-2018-PALU", "publisher": "U.S. Geological Survey", "dataset": "USGS event impact page", "record_id": "us1000h3p4", "url": "https://earthquake.usgs.gov/earthquakes/eventpage/us1000h3p4/impact", "license_status": "public government source", "retrieved_at": "2026-08-28T00:00:00Z"},
    "conflict_id": null,
    "resolution_id": null,
    "audit_state": "AUDITED",
    "audit_notes": null
  },
  {
    "observation_id": "USGS-SULAWESI-2018-DAMAGE",
    "event_id": "GDA-EQ-2018-IDN-SULAWESI",
    "field": "economic.damage",
    "raw_value": 911000000,
    "normalized_value": 911000000,
    "unit": "USD",
    "definition": "Damage estimate reported by USGS for the combined disaster sequence.",
    "status": "estimated",
    "source": {"source_id": "USGS-IDN-2018-PALU", "publisher": "U.S. Geological Survey", "dataset": "USGS event impact page", "record_id": "us1000h3p4", "url": "https://earthquake.usgs.gov/earthquakes/eventpage/us1000h3p4/impact", "license_status": "public government source", "retrieved_at": "2026-08-28T00:00:00Z"},
    "conflict_id": null,
    "resolution_id": null,
    "audit_state": "AUDITED",
    "audit_notes": null
  },
  {
    "observation_id": "NOAA-KATRINA-2005-DEATHS",
    "event_id": "GDA-CY-2005-KATRINA",
    "field": "deaths",
    "raw_value": 1200,
    "normalized_value": 1200,
    "unit": "persons",
    "definition": "Approximately 1,200 reported deaths in the NOAA National Hurricane Center historical summary; scope is U.S. deaths directly attributed in that summary.",
    "status": "estimated",
    "source": {"source_id": "NOAA-NHC-KATRINA", "publisher": "NOAA National Hurricane Center", "dataset": "Hurricanes in History", "record_id": null, "url": "https://www.nhc.noaa.gov/outreach/history/", "license_status": "public government source", "retrieved_at": "2026-08-28T00:00:00Z"},
    "conflict_id": "C-KATRINA-DEATHS", "resolution_id": null, "audit_state": "AUDITED", "audit_notes": "NHC historical page and archived NHC material use different estimates (approximately 1,200 vs 1,500). Both must remain source-specific."
  },
  {
    "observation_id": "NOAA-KATRINA-2005-DAMAGE",
    "event_id": "GDA-CY-2005-KATRINA",
    "field": "economic.damage",
    "raw_value": 125000000000,
    "normalized_value": 125000000000,
    "unit": "USD_2005",
    "definition": "Current NOAA/NCEI damage estimate for Katrina in the United States, expressed in 2005 dollars, with a 90% confidence interval of USD 97.4B–145.5B.",
    "status": "estimated",
    "source": {"source_id": "NOAA-NHC-KATRINA-TCR", "publisher": "NOAA National Hurricane Center", "dataset": "Tropical Cyclone Report AL122005", "record_id": "AL122005", "url": "https://www.nhc.noaa.gov/data/tcr/AL122005_Katrina.pdf", "license_status": "public government source", "retrieved_at": "2026-08-28T00:00:00Z"},
    "conflict_id": "C-KATRINA-DAMAGE", "resolution_id": null, "audit_state": "AUDITED", "audit_notes": "Historical summaries contain lower nominal estimates; the current NCEI estimate is preserved with its vintage and confidence interval."
  }
]
