[
  {
    "observation_id": "NOAA-TSUNAMI-2004-IO-DEATHS",
    "event_id": "GDA-2004-INDIAN-OCEAN-TSUNAMI",
    "field": "deaths",
    "raw_value": 227898,
    "normalized_value": 227898,
    "unit": "persons",
    "definition": "Deaths and missing attributed to the Indian Ocean tsunami in NOAA/NCEI summary.",
    "status": "reported",
    "source": {"source_id": "NOAA-NCEI-TSUNAMI", "publisher": "NOAA National Centers for Environmental Information", "dataset": "Global Historical Tsunami Database", "record_id": null, "url": "https://www.ncei.noaa.gov/products/natural-hazards/tsunamis-earthquakes-volcanoes/tsunamis/global-historical-data", "license_status": "verify source-specific terms", "retrieved_at": "2026-08-28T00:00:00Z"},
    "conflict_id": "C-2004-INDIAN-OCEAN-DEATHS",
    "resolution_id": null,
    "audit_state": "AUDITED",
    "audit_notes": "NOAA/NCEI source observation preserved; reconciliation with alternate NOAA presentation remains explicit."
  },
  {
    "observation_id": "NOAA-TSUNAMI-1960-CHILE-DEATHS-RANGE",
    "event_id": "GDA-1960-CHILE-EQ-TSUNAMI",
    "field": "deaths",
    "raw_value": "490-5700",
    "normalized_value": {"min": 490, "max": 5700},
    "unit": "persons",
    "definition": "Reported fatality range in NOAA/NCEI account of the 1960 Chile earthquake and tsunami.",
    "status": "reported",
    "source": {"source_id": "NOAA-NCEI-TSUNAMI", "publisher": "NOAA National Centers for Environmental Information", "dataset": "Significant Earthquake and Tsunami Events", "record_id": null, "url": "https://www.ncei.noaa.gov/news/day-1960-chilean-earthquake-and-tsunami", "license_status": "verify source-specific terms", "retrieved_at": "2026-08-28T00:00:00Z"},
    "conflict_id": null,
    "resolution_id": null,
    "audit_state": "AUDITED",
    "audit_notes": "Range preserved; no artificial point estimate."
  },
  {
    "observation_id": "WB-PAK-2022-AFFECTED",
    "event_id": "GDA-2022-PAK-FLOOD",
    "field": "affected",
    "raw_value": 33000000,
    "normalized_value": 33000000,
    "unit": "persons",
    "definition": "People affected by the 2022 Pakistan floods in the PDNA assessment.",
    "status": "reported",
    "source": {"source_id": "WB-PAK-2022-PDNA", "publisher": "World Bank / Government of Pakistan PDNA", "dataset": "Pakistan Floods 2022 Post-Disaster Needs Assessment", "record_id": null, "url": "https://www.worldbank.org/en/news/press-release/2022/10/28/pakistan-flood-damages-and-economic-losses-over-usd-30-billion-and-reconstruction-needs-over-usd-16-billion-new-assessme", "license_status": "public report; verify reuse terms", "retrieved_at": "2026-08-28T00:00:00Z"},
    "conflict_id": null,
    "resolution_id": null,
    "audit_state": "AUDITED",
    "audit_notes": null
  },
  {
    "observation_id": "WB-PAK-2022-DAMAGE",
    "event_id": "GDA-2022-PAK-FLOOD",
    "field": "economic.damage",
    "raw_value": 14900000000,
    "normalized_value": 14900000000,
    "unit": "USD",
    "definition": "Direct physical damage assessed in the 2022 Pakistan PDNA.",
    "status": "reported",
    "source": {"source_id": "WB-PAK-2022-PDNA", "publisher": "World Bank / Government of Pakistan PDNA", "dataset": "Pakistan Floods 2022 Post-Disaster Needs Assessment", "record_id": null, "url": "https://www.worldbank.org/en/news/press-release/2022/10/28/pakistan-flood-damages-and-economic-losses-over-usd-30-billion-and-reconstruction-needs-over-usd-16-billion-new-assessme", "license_status": "public report; verify reuse terms", "retrieved_at": "2026-08-28T00:00:00Z"},
    "conflict_id": null,
    "resolution_id": null,
    "audit_state": "AUDITED",
    "audit_notes": null
  },
  {
    "observation_id": "WB-PAK-2022-LOSS",
    "event_id": "GDA-2022-PAK-FLOOD",
    "field": "economic.loss",
    "raw_value": 15200000000,
    "normalized_value": 15200000000,
    "unit": "USD",
    "definition": "Economic losses assessed in the 2022 Pakistan PDNA; distinct from physical damage.",
    "status": "reported",
    "source": {"source_id": "WB-PAK-2022-PDNA", "publisher": "World Bank / Government of Pakistan PDNA", "dataset": "Pakistan Floods 2022 Post-Disaster Needs Assessment", "record_id": null, "url": "https://www.worldbank.org/en/news/press-release/2022/10/28/pakistan-flood-damages-and-economic-losses-over-usd-30-billion-and-reconstruction-needs-over-usd-16-billion-new-assessme", "license_status": "public report; verify reuse terms", "retrieved_at": "2026-08-28T00:00:00Z"},
    "conflict_id": null,
    "resolution_id": null,
    "audit_state": "AUDITED",
    "audit_notes": null
  },
  {
    "observation_id": "WB-PAK-2022-RECON",
    "event_id": "GDA-2022-PAK-FLOOD",
    "field": "economic.reconstruction_needs",
    "raw_value": 16300000000,
    "normalized_value": 16300000000,
    "unit": "USD",
    "definition": "Reconstruction and recovery needs assessed in the 2022 Pakistan PDNA; distinct from damage and economic loss.",
    "status": "reported",
    "source": {"source_id": "WB-PAK-2022-PDNA", "publisher": "World Bank / Government of Pakistan PDNA", "dataset": "Pakistan Floods 2022 Post-Disaster Needs Assessment", "record_id": null, "url": "https://www.worldbank.org/en/news/press-release/2022/10/28/pakistan-flood-damages-and-economic-losses-over-usd-30-billion-and-reconstruction-needs-over-usd-16-billion-new-assessme", "license_status": "public report; verify reuse terms", "retrieved_at": "2026-08-28T00:00:00Z"},
    "conflict_id": null,
    "resolution_id": null,
    "audit_state": "AUDITED",
    "audit_notes": null
  }
]
